id,codigo,nome,criador,pais_origem,periodo,descricao_curta,descricao_completa,principios_fundamentais,filosofia,publico_alvo,instrumentos_principais,metodologia_ensino,pontos_fortes,limitacoes,aplicacao_brasil,nivel_dificuldade,idade_minima,recursos_necessarios,cor_tema,icone,ordem_apresentacao,ativo,created_at,updated_at
28ff3697-1df2-48a6-a961-2f10054a3720,LCE,Lincoln Center Education,Lincoln Center Institute,Estados Unidos (Nova York),1970s-presente,"Abordagem educacional multiculturalista que integra música, artes cênicas, visuais, literatura e cultura contemporânea.","Promove a arte como agente transformador na educação através de experiências estéticas diversas e inclusivas. Desenvolve sensibilidade estética crítica, promove inclusão através das artes e integra múltiplas linguagens artísticas para formar cidadãos criativos e empáticos.","[""Arte para todos como direito fundamental"",""Multiculturalismo e valorização da diversidade"",""Processo criativo sobre produto final"",""Artes integradas e interdisciplinaridade"",""Aprendizagem experiencial"",""Educação estética crítica""]","A arte é um direito humano fundamental que deve ser acessível a todos. O processo criativo é mais importante que o produto final, e a diversidade cultural deve ser celebrada e integrada ao aprendizado.","Estudantes de 6-18 anos, educadores, comunidades escolares e famílias interessadas em educação através das artes integradas","[""Espaços flexíveis para criação"",""Materiais artísticos diversos"",""Acesso a artistas e espaços culturais"",""Tecnologia básica para registro"",""Parcerias comunitárias""]","Oficinas interdisciplinares, projetos comunitários, residências artísticas, festivais escolares, portfólios artísticos e parcerias com espaços culturais","[""Desenvolve sensibilidade estética crítica"",""Promove inclusão social através das artes"",""Integra múltiplas linguagens artísticas"",""Valoriza diversidade cultural"",""Estimula protagonismo artístico"",""Fortalece vínculos comunitários""]","[""Necessidade de formação docente especializada"",""Risco de dispersão curricular"",""Desafios de avaliação objetiva"",""Dependência de recursos externos"",""Pressão por resultados tradicionais""]","Adaptação ao contexto multicultural brasileiro, integração com culturas locais, projetos em escolas públicas, parcerias com SESC, ONGs, Instituto Itaú Cultural, valorização de expressões urbanas e regionais",3,6,"[""Espaços culturais diversos"",""Materiais artísticos variados"",""Equipamento de registro"",""Artistas parceiros"",""Tecnologia acessível""]",#FF1744,🎭,9,true,2025-10-04 04:50:35.314966+00,2025-10-04 04:50:35.314966+00
5122d3b5-3f1e-4cb0-bc9b-ff6e140a51a2,berklee,Berklee Method,Lawrence Berk,Estados Unidos,1940-1960,Metodologia de música contemporânea focada em performance e criatividade.,"O Método Berklee é uma abordagem contemporânea que integra técnica, teoria, performance e tecnologia musical para formação de músicos profissionais.","[""Música contemporânea como base"",""Integração teoria-prática"",""Performance como objetivo"",""Tecnologia musical"",""Criatividade e composição""]","A educação musical deve preparar músicos para o mercado atual, integrando tradição e inovação.",Adolescentes e adultos (16+ anos) com interesse em música profissional e contemporânea.,"[""Instrumentos eletrônicos"",""Computadores e software"",""Instrumentos tradicionais adaptados"",""Equipamentos de gravação""]","Ensembles práticos, teoria aplicada, uso de tecnologia, composição e arranjo, preparação para indústria musical.","[""Prepara para mercado atual"",""Integra tecnologia"",""Foco em criatividade"",""Networking profissional"",""Versatilidade musical""]","[""Pode ser comercial demais"",""Requer equipamentos caros"",""Menos foco em tradição clássica"",""Competitivo""]",Excelente para o Brasil pela forte indústria musical nacional. Usado em escolas de música popular e universidades.,4,16,"[""Instrumentos profissionais"",""Tecnologia musical avançada"",""Acesso à indústria musical"",""Formação em música contemporânea""]",#E67E22,microphone-alt,8,true,2025-10-04 03:22:59.975865+00,2025-10-04 03:22:59.975865+00
68632b58-86b0-44e7-becc-69099e78764d,musical_futures,Musical Futures,Paul Sanderson,Reino Unido,2000-2010,Aprendizado musical informal baseado em práticas da música popular.,"Musical Futures é uma abordagem pedagógica que replica as formas naturais de aprendizado musical encontradas na música popular, enfatizando colaboração, escolha e aprendizado pelos pares.","[""Aprendizado informal e natural"",""Música popular como base"",""Colaboração entre pares"",""Escolha do aluno central"",""Tecnologia integrada""]",Os jovens aprendem música de forma mais eficaz quando podem escolher o que querem aprender e trabalhar colaborativamente.,Adolescentes e jovens adultos (12+ anos). Especialmente eficaz para engajar estudantes desinteressados na música tradicional.,"[""Instrumentos eletrônicos"",""Computadores e software musical"",""Instrumentos de banda"",""Equipamentos de gravação""]","Aprendizado através de cópia e imitação, composição colaborativa, uso de tecnologia musical, performance em grupos pequenos.","[""Alta motivação dos estudantes"",""Conecta com cultura jovem"",""Desenvolve criatividade"",""Usa tecnologia atual"",""Flexível e adaptável""]","[""Menor foco em técnica tradicional"",""Requer equipamentos tecnológicos"",""Pode negligenciar teoria musical formal""]",Muito adequado para o Brasil pela forte cultura de música popular. Usado em escolas públicas e projetos sociais.,2,12,"[""Instrumentos eletrônicos"",""Computadores com software musical"",""Equipamentos de áudio"",""Acesso à internet""]",#9B59B6,guitar,4,true,2025-10-04 03:22:59.975865+00,2025-10-04 03:22:59.975865+00
8622a0d3-c389-47bf-a3a9-843bfcc293a2,suzuki,Método Suzuki,Shinichi Suzuki,Japão,1940-1960,"Método baseado na ""língua materna"" onde crianças aprendem música da mesma forma que aprendem a falar.","O Método Suzuki, também conhecido como ""Método da Língua Materna"", é uma filosofia educacional que aplica os princípios de aquisição da linguagem ao aprendizado musical.","[""Toda criança pode aprender"",""Começar cedo é fundamental"",""Ambiente rico em música"",""Escutar precede tocar"",""Participação ativa dos pais""]","O potencial musical é inato em todas as crianças. Através de amor, paciência e ambiente musical rico, qualquer criança pode desenvolver alta habilidade musical.","Crianças pequenas (3-6 anos idealmente), mas adaptável para qualquer idade. Funciona melhor com envolvimento familiar.","[""Violino (mais comum)"",""Piano"",""Violoncelo"",""Viola"",""Flauta"",""Harpa""]","Escuta diária do repertório, imitação do professor, prática constante, participação dos pais, aulas individuais e em grupo.","[""Desenvolve disciplina e concentração"",""Resulta em alta técnica instrumental"",""Fortalece vínculo familiar"",""Cultiva sensibilidade musical refinada""]","[""Requer comprometimento intenso dos pais"",""Pode ser rígido demais"",""Enfoque limitado em criatividade"",""Método caro (aulas individuais)""]",Adaptação crescente no Brasil através de institutos especializados. Compatível com valores familiares brasileiros.,4,3,"[""Instrumento adequado ao tamanho"",""Professor certificado Suzuki"",""Equipamento de áudio para escuta"",""Comprometimento parental total""]",#E74C3C,violin,2,true,2025-10-04 03:22:59.975865+00,2025-10-04 03:22:59.975865+00
99551ce6-bdc4-4cd2-b72f-728cc09f36ae,dalcroze,Dalcroze Eurythmics,Émile Jaques-Dalcroze,Suíça,1900-1920,Educação musical através do movimento corporal e euritmia.,"A Euritmia de Dalcroze é um método que desenvolve a musicalidade através do movimento corporal consciente, conectando música, mente e corpo.","[""Movimento corporal consciente"",""Integração música-corpo-mente"",""Desenvolvimento rítmico"",""Improvisação musical"",""Expressão através do movimento""]",O corpo é o primeiro instrumento musical. O movimento consciente desenvolve a compreensão musical interna.,"Todas as idades, desde crianças pequenas até adultos. Especialmente benéfico para desenvolvimento rítmico.","[""Piano (principal)"",""Instrumentos de percussão"",""Objetos para movimento (lenços, bolas)"",""Espaço amplo para movimento""]","Exercícios de movimento e música, improvisação corporal, desenvolvimento rítmico através do corpo, expressão musical através do movimento.","[""Desenvolve consciência corporal"",""Melhora coordenação"",""Integra música e movimento"",""Desenvolve musicalidade interna""]","[""Requer espaço adequado"",""Formação específica necessária"",""Pode ser intimidante para alguns"",""Foco limitado em técnica instrumental""]","Bem recebido no Brasil pela cultura corporal rica. Usado em escolas de dança, música e teatro.",3,4,"[""Espaço amplo para movimento"",""Piano"",""Formação em Dalcroze"",""Materiais para movimento""]",#F39C12,running,5,true,2025-10-04 03:22:59.975865+00,2025-10-04 03:22:59.975865+00
a5a5b85d-bace-4415-90bb-01c80cb1564c,kodaly,Método Kodály,Zoltán Kodály,Hungria,1920-1940,Desenvolvimento musical através da voz humana e música folclórica nacional.,O Método Kodály é uma abordagem abrangente para educação musical que usa a voz humana como instrumento primário e a música folclórica como material básico.,"[""A voz é o instrumento mais acessível"",""Música folclórica como base"",""Desenvolvimento sequencial"",""Leitura musical fluente""]",A música é um direito de todos. O desenvolvimento musical deve começar com a própria cultura musical da criança.,"Crianças a partir de 5 anos, com aplicação em todas as idades. Especialmente eficaz no ensino fundamental.","[""Voz humana (principal)"",""Instrumentos folclóricos"",""Piano (apoio)"",""Instrumentos de percussão simples""]","Sequência pedagógica rigorosa usando solfejo relativo, manossolfa, leitura musical progressiva e repertório folclórico nacional.","[""Desenvolve ouvido musical refinado"",""Acessível economicamente"",""Preserva patrimônio cultural"",""Base sólida para leitura musical""]","[""Requer formação específica intensiva"",""Pode ser muito teórico"",""Dependente da qualidade vocal do professor""]",Excelente adaptação ao Brasil pela riqueza do folclore nacional. Usado em conservatórios e escolas de música erudita.,3,5,"[""Formação específica em Kodály"",""Repertório folclórico nacional"",""Piano para apoio harmônico"",""Material didático especializado""]",#2ECC71,microphone,3,true,2025-10-04 03:22:59.975865+00,2025-10-04 03:22:59.975865+00
a8a09c03-0771-4b2a-911b-8a357f312b63,waldorf,Pedagogia Waldorf Musical,Rudolf Steiner,Alemanha,1910-1920,Educação musical integral baseada no desenvolvimento antroposófico.,"A Pedagogia Waldorf aborda a música como parte integral do desenvolvimento humano, respeitando as fases evolutivas da criança.","[""Desenvolvimento por fases etárias"",""Integração com outras artes"",""Música como desenvolvimento humano"",""Respeito ao ritmo natural"",""Arte como necessidade""]",A música é uma necessidade humana fundamental que deve ser cultivada respeitando o desenvolvimento natural da criança.,Crianças e adolescentes (0-18 anos) com abordagens específicas para cada fase do desenvolvimento.,"[""Flauta doce"",""Lira"",""Instrumentos de corda"",""Percussão natural"",""Canto""]","Progressão por setênios, integração música-movimento-artes, repertório adequado à idade, desenvolvimento técnico gradual.","[""Desenvolvimento integral"",""Respeita individualidade"",""Integra múltiplas linguagens"",""Cultiva sensibilidade artística""]","[""Progressão pode ser lenta"",""Requer formação antroposófica"",""Menos foco em performance"",""Limitado em música contemporânea""]",Presente no Brasil através de escolas Waldorf. Adequado à valorização da infância e desenvolvimento integral.,3,3,"[""Formação em Pedagogia Waldorf"",""Instrumentos específicos (flauta, lira)"",""Compreensão do desenvolvimento infantil""]",#8E44AD,leaf,7,true,2025-10-04 03:22:59.975865+00,2025-10-04 03:22:59.975865+00
d64dac55-ed34-4f4d-93c7-d6fca955eff5,orff_schulwerk,Orff Schulwerk,Carl Orff,Alemanha,1930-1950,"Abordagem criativa combinando música, movimento e fala através de instrumentos de percussão.","O Orff Schulwerk é uma abordagem pedagógica musical que enfatiza a educação musical através da experiência prática e criativa. Desenvolvida por Carl Orff, esta metodologia integra música, movimento, drama e fala como elementos fundamentais do aprendizado musical.","[""Integração de música, movimento e fala"",""Aprendizado através da experiência prática"",""Criatividade e improvisação como base"",""Uso de instrumentos acessíveis""]","A música deve ser vivenciada pelo corpo inteiro. O aprendizado musical acontece naturalmente através do brincar, cantar, dançar e tocar.","Crianças a partir de 3 anos, adolescentes e adultos. Especialmente eficaz para educação infantil.","[""Xilofones diatônicos e cromáticos"",""Metalofones"",""Glockenspiel"",""Tambores de vários tamanhos"",""Instrumentos de percussão diversos""]","Baseada na progressão natural: imitação → exploração → criação. As aulas incluem aquecimentos com movimento, exploração de instrumentos, criação musical coletiva.","[""Desenvolve criatividade musical"",""Acessível para não-músicos"",""Integra múltiplas linguagens"",""Promove trabalho em equipe""]","[""Requer instrumentos específicos caros"",""Necessita espaço amplo"",""Formação específica do professor""]",Muito bem adaptado ao contexto brasileiro pela valorização da criatividade e movimento. Compatível com a cultura musical diversificada do país.,2,3,"[""Instrumentos Orff (xilofones, metalofones)"",""Espaço amplo para movimento"",""Equipamento de som"",""Formação específica do educador""]",#FF6B35,music-note,1,true,2025-10-04 03:22:59.975865+00,2025-10-04 03:22:59.975865+00
eaf8c6d8-d709-4b2a-8b6e-8ecdbbc772b0,gordon,Music Learning Theory (Gordon),Edwin Gordon,Estados Unidos,1970-1990,Teoria da Audiação Musical - desenvolvimento da compreensão musical interna.,A Teoria da Aprendizagem Musical de Edwin Gordon baseia-se no conceito de audiação - a capacidade de ouvir e compreender música mentalmente.,"[""Audiação como base"",""Desenvolvimento sequencial"",""Padrões tonais e rítmicos"",""Aprendizagem musical natural"",""Vocabulário musical""]",A audiação é para a música o que o pensamento é para a linguagem. Deve ser desenvolvida antes da performance.,"Bebês a adultos, com metodologias específicas para cada faixa etária. Especialmente importante nos primeiros anos.","[""Voz humana (principal)"",""Instrumentos melódicos simples"",""Instrumentos de percussão"",""Piano (para padrões)""]","Desenvolvimento de vocabulário musical através de padrões, respiração musical, movimento livre, improvisação estruturada.","[""Base científica sólida"",""Desenvolve musicalidade profunda"",""Metodologia abrangente"",""Aplicável a qualquer estilo musical""]","[""Complexo para implementar"",""Requer formação específica intensa"",""Pode ser muito teórico inicialmente""]",Crescente interesse no Brasil em conservatórios e universidades. Adequado para formação de educadores musicais.,4,0,"[""Formação específica em Gordon"",""Compreensão de padrões musicais"",""Material didático específico""]",#3498DB,brain,6,true,2025-10-04 03:22:59.975865+00,2025-10-04 03:22:59.975865+00