id,nome,descricao,periodo_inicio,periodo_fim,caracteristicas,principios_esteticos,compositores_representativos,obras_importantes,periodos_relacionados,contexto_historico,influencias,legado,imagem_url,cor_tematica,ordem_cronologica,nivel_importancia,tags,ativo,created_at,updated_at
135fd887-9e79-4adf-a71e-36a486ece177,Renascimento Musical,"Período de renovação cultural que valorizou a polifonia, a música vocal sacra e profana. Surgimento da ópera.",1400,1600,"[""Polifonia complexa"", ""Música vocal predominante"", ""Surgimento da ópera"", ""Valorização do humanismo""]",,"[""Palestrina"",""Josquin des Prez"",""Giovanni Gabrieli""]",,,,,,,,,,,true,2025-10-27 16:02:25.422441+00,2025-10-27 16:02:25.422441+00
3e6b7fdc-6420-4d82-929d-265b12cb1102,Barroco,"Caracterizado por ornamentação, contrastes dramáticos, baixo contínuo e desenvolvimento da música instrumental.",1600,1750,"[""Ornamentação elaborada"", ""Contraste dramático"", ""Baixo contínuo"", ""Fuga e concerto grosso""]",,"[""Bach"",""Handel"",""Vivaldi"",""Monteverdi""]",,,,,,,,,,,true,2025-10-27 16:02:25.422441+00,2025-10-27 16:02:25.422441+00
5181ad3b-648a-4c06-a93d-8054f2bcf622,Modernismo,"Ruptura com tradições tonais, experimentação com atonalidade, serialismo, novas técnicas de composição.",1900,1950,"[""Atonalidade"", ""Serialismo"", ""Experimentação rítmica"", ""Novas texturas""]",,"[""Schoenberg"",""Stravinsky"",""Bartók"",""Berg""]",,,,,,,,,,,true,2025-10-27 16:02:25.422441+00,2025-10-27 16:02:25.422441+00
90eb26ac-1dfb-4b30-a5e1-b0220903fabe,Impressionismo,"Uso de timbres sutis, harmonias não convencionais, atmosferas evocativas. Inspiração na natureza e na poesia.",1890,1920,"[""Timbres sutis"", ""Harmonias não funcionais"", ""Atmosferas evocativas"", ""Escalas exóticas""]",,"[""Debussy"",""Ravel""]",,,,,,,,,,,true,2025-10-27 16:02:25.422441+00,2025-10-27 16:02:25.422441+00
e1b3121b-4302-4782-8604-97975483d689,Classicismo,"Busca por equilíbrio, clareza formal e melodias elegantes. Desenvolvimento da sonata e da sinfonia.",1750,1820,"[""Forma sonata"", ""Sinfonia clássica"", ""Clareza e equilíbrio"", ""Melodias elegantes""]",,"[""Mozart"",""Haydn"",""Beethoven (inicial)""]",,,,,,,,,,,true,2025-10-27 16:02:25.422441+00,2025-10-27 16:02:25.422441+00
ee172603-b517-4262-ac69-f096e90c8023,Romantismo,"Expressão emocional intensa, nacionalismo musical, expansão da orquestra e do piano. Lied e poema sinfônico.",1820,1900,"[""Expressão emocional"", ""Nacionalismo"", ""Orquestra expandida"", ""Programatismo""]",,"[""Chopin"",""Schumann"",""Wagner"",""Brahms"",""Tchaikovsky""]",,,,,,,,,,,true,2025-10-27 16:02:25.422441+00,2025-10-27 16:02:25.422441+00