id,nome_completo,nome_artistico,data_nascimento,data_falecimento,pais_nascimento,cidade_nascimento,periodo_id,biografia_curta,biografia_completa,principais_obras,estilo_musical,instrumentos_tocados,curiosidades,foto_url,audio_assinatura_url,nivel_importancia,tags,ativo,created_at
d2489059-8725-4e79-a729-8b14002578c0,Dmitri Dmitriyevich Shostakovich,Shostakovich,1906-09-25,1975-08-09,Rússia/URSS,São Petersburgo,a8106bcd-4791-46f4-b502-bda5fe19c041,Sobreviveu a Stalin compondo sinfonias ambíguas que criticavam e elogiavam o regime simultaneamente,"Dmitri Shostakovich (1906-1975) foi o maior compositor soviético, vivendo sob tirania stalinista. Prodígio, graduou-se no Conservatório de Leningrado aos 19 anos com Sinfonia nº 1 (1925). Sucesso inicial com ópera Lady Macbeth do Distrito de Mtsensk (1934). Mas Stalin assistiu, ofendeu-se, e Pravda publicou artigo Caos ao Invés de Música (1936), denunciando Shostakovich. Passou a viver em terror constante de ser preso e executado (Grande Expurgo 1936-1938). Dormia vestido na escada, para não acordar família se polícia secreta viesse. Compôs 15 sinfonias, 15 quartetos de cordas, concertos, óperas, trilhas para cinema. Obras principais: Sinfonia nº 5 (1937, resposta a críticas, ambiguamente conformista), Sinfonia nº 7 Leningrado (1941, durante cerco nazista), Sinfonia nº 10 (1953, após morte de Stalin, retrato musical do tirano?), Quarteto nº 8 (autobiográfico, assinatura DSCH). Estilo: sarcasmo, ironia, grotesco, marches fúnebres, citações, ambiguidade (criticava regime codificadamente). Forçado a aderir ao Partido (1960), viveu atormentado. Morreu de câncer aos 68 anos. Testamento (livro) publicado no Ocidente é controverso (autenticidade disputada).","[""Sinfonia nº 5 em Ré menor Op. 47"",""Sinfonia nº 7 Leningrado Op. 60"",""Sinfonia nº 10 em Mi menor Op. 93"",""Quarteto de Cordas nº 8 em Dó menor Op. 110"",""Lady Macbeth do Distrito de Mtsensk (ópera)"",""Concerto para Piano nº 2"",""Jazz Suite nº 2"",""Prelúdios e Fugas Op. 87 (24 peças)"",""Concerto para Violoncelo nº 1"",""Sinfonia nº 13 Babi Yar""]",Modernismo soviético,"[""Piano""]","[{""texto"": ""Após Stalin assistir Lady Macbeth (1936) e se ofender, Pravda publicou Caos ao Invés de Música, denunciando-o. Shostakovich viveu em terror de prisão e execução durante Grande Expurgo. Dormia vestido na escada."", ""titulo"": ""Caos ao Invés de Música"", ""categoria"": ""perseguicao""}, {""texto"": ""Compôs Sinfonia nº 7 Leningrado (1941) durante cerco nazista de 900 dias. Tema da invasão (marcha crescente) representa nazismo OU stalinismo (ambiguidade intencional). Estreou em Leningrado sitiada."", ""titulo"": ""Sinfonia nº 7 durante cerco de Leningrado"", ""categoria"": ""guerra""}]",https://upload.wikimedia.org/wikipedia/commons/thumb/7/79/Shostakovich_signature.svg/800px-Shostakovich_signature.svg.png,https://www.youtube.com/watch?v=ogJFXqYEYd8,4,"[""modernismo"",""russo"",""sovietico"",""sinfonia"",""stalin""]",true,2025-10-09 02:50:34.631005+00
d5bdcd5d-27f2-4133-a511-097e3e0ea709,Franz Liszt,,1811-10-22,1886-07-31,Hungria,Raiding,e8ce8fcc-5d20-4557-be06-c908b975e141,Maior virtuose do piano de todos os tempos. Inventor do poema sinfônico e do recital solo moderno,"Franz Liszt (1811-1886) foi o maior virtuose do piano da história e figura central do romantismo. Criança prodígio húngara, estudou com Czerny (aluno de Beethoven) e Salieri em Viena. Aos 11 tocou para Beethoven. Carreira de pianista virtuose em Paris (1827-1847): mulheres desmaiavam em concertos (Lisztomania). Inventou o recital solo moderno. Técnica transcendental: oitavas, saltos, glissandi, tremolo. Escreveu música pianística de dificuldade inédita (Estudos Transcendentais, Paganini Etudes, Mazeppa). Relacionamento com Condessa Marie d'Agoult (3 filhos, incluindo Cosima que casou com Wagner) e depois com Princesa Carolyne zu Sayn-Wittgenstein. Em Weimar, promoveu música nova (Wagner, Berlioz), compôs poemas sinfônicos (inventou o termo e o gênero), 2 concertos para piano, Sonata em Si menor. Fase final: tornou-se Abade, viveu entre Roma, Weimar, Budapeste; deu aulas gratuitas. Obras tardias antecipam impressionismo e atonalidade (Bagatela sem Tonalidade, 1885). Morreu aos 74 anos em Bayreuth.","[""Sonata em Si menor (piano)"",""Concerto para Piano nº 1 em Mi bemol maior"",""Rapsódia Húngara nº 2"",""Estudos de Execução Transcendental"",""Poema Sinfônico Les Préludes"",""La Campanella (de Paganini Etudes)"",""Liebestraum nº 3 (Sonho de Amor)"",""Années de Pèlerinage (Anos de Peregrinação, 3 suítes)"",""Mephisto Waltz nº 1"",""Consolações""]",Romantismo virtuosístico,"[""Piano""]","[{""texto"": ""Nos anos 1840, concertos de Liszt causavam histeria: fãs colecionavam luvas e fios de cabelo; mulheres desmaiavam. Primeira superstar musical moderna."", ""titulo"": ""Lisztomania"", ""categoria"": ""fama""}, {""texto"": ""Em 1865 recebeu ordens menores na Igreja Católica, tornando-se Abade (Abbé Liszt), mas seguiu tocando e compondo."", ""titulo"": ""Abade virtuose"", ""categoria"": ""religiao""}, {""texto"": ""Deu aulas gratuitamente a centenas de alunos em Weimar. Formou gerações de pianistas."", ""titulo"": ""Professor generoso"", ""categoria"": ""ensino""}]",https://upload.wikimedia.org/wikipedia/commons/thumb/4/48/Franz_Liszt_1858.jpg/800px-Franz_Liszt_1858.jpg,https://www.youtube.com/watch?v=H1Dvg2MxQn8,5,"[""romantico"",""hungaro"",""virtuose"",""piano"",""poema_sinfonico""]",true,2025-10-09 02:22:14.349741+00
e23ae30f-1410-4610-b30f-8f12fc8e8bdd,Yoko Kanno,Kanno,1963-03-18,,Japão,,bf731274-4647-4e61-aa72-2ac8a0b3944c,"Compositora prolífica de trilhas sonoras para anime. Versatilidade impressionante: jazz, rock, eletrônica, orquestral. Conhecida por Cowboy Bebop, Ghost in the Shell e Macross Plus.","Yoko Kanno é uma das compositoras mais versáteis e respeitadas da música japonesa. Conhecida principalmente por suas trilhas sonoras de anime, domina praticamente todos os gêneros musicais: jazz fusion, rock, eletrônica, música clássica, folk, e muito mais. ""Tank!"", tema de abertura de Cowboy Bebop, é considerada uma das melhores músicas de anime de todos os tempos. Trabalha frequentemente com a banda The Seatbelts e já compôs para jogos, filmes live-action e comerciais. Sua habilidade de capturar a essência emocional de uma narrativa através da música é lendária.","[""Tank! (Cowboy Bebop)"",""Inner Universe (Ghost in the Shell)"",""Voices""]","Trilhas sonoras, Jazz fusion, J-Pop, Eletrônica",,"[{""texto"": ""Kanno pode compor big band jazz numa semana, música eletrônica experimental na seguinte, e uma balada orquestral depois. Sua versatilidade é incomparável."", ""titulo"": ""Mestre de todos os gêneros""}, {""texto"": ""Formou a banda The Seatbelts especificamente para Cowboy Bebop, reunindo músicos de jazz de elite do Japão para criar o som único da série."", ""titulo"": ""The Seatbelts""}]",,,5,,true,2025-12-14 20:49:33.510717+00
efa0d7ad-57ee-4d53-b74f-4aae46be0634,Pyotr Ilyich Tchaikovsky,Tchaikovsky,1840-05-07,1893-11-06,Rússia,Votkinsk,e8ce8fcc-5d20-4557-be06-c908b975e141,Mestre da orquestração e melodias inesquecíveis. Criador dos balés mais populares do mundo,"Pyotr Ilyich Tchaikovsky (1840-1893) é o compositor russo mais popular mundialmente. Inicialmente estudou direito, só aos 21 anos dedicou-se à música profissionalmente no recém-fundado Conservatório de São Petersburgo (Anton Rubinstein). Tornou-se professor no Conservatório de Moscou (1866). Sua música combina melodias intensamente líricas, orquestração brilhante e emocionalidade romântica extrema com maestria formal. Embora russo, não integrava o nacionalista Grupo dos Cinco (Balakirev, Mussorgsky, Rimsky-Korsakov, Borodin, Cui), sendo mais cosmopolita e ocidentalizado. Obras principais: 3 balés supremos (O Lago dos Cisnes 1876, A Bela Adormecida 1889, O Quebra-Nozes 1892 - os mais executados do mundo), 6 sinfonias (especialmente nº 6 Pathétique 1893), Concerto para Piano nº 1 (1875, um dos mais populares), Concerto para Violino (1878), óperas (Eugene Onegin 1879, A Dama de Espadas 1890), Abertura 1812 (com canhões!), Romeu e Julieta. Vida pessoal torturada: homossexualidade reprimida, casamento desastroso (1877, durou semanas), tentativa de suicídio. Mecenato de Nadezhda von Meck (14 anos de correspondência, nunca se encontraram pessoalmente). Morreu aos 53 anos, oficialmente de cólera (bebeu água não-fervida), mas teorias sugerem suicídio. Suas sinfonias e balés são pilares do repertório orquestral mundial.","[""O Quebra-Nozes (balé completo)"",""O Lago dos Cisnes (balé completo)"",""A Bela Adormecida (balé completo)"",""Sinfonia nº 6 em Si menor Pathétique Op. 74"",""Concerto para Piano nº 1 em Si bemol menor Op. 23"",""Concerto para Violino em Ré maior Op. 35"",""Abertura 1812 Op. 49"",""Romeu e Julieta (abertura-fantasia)"",""Ópera Eugene Onegin"",""Serenata para Cordas em Dó maior Op. 48""]",Romantismo russo,"[""Piano""]","[{""texto"": ""Foi sustentado por 14 anos pela viúva milionária Nadezhda von Meck. Trocaram mais de 1.200 cartas mas ela exigiu nunca se encontrarem pessoalmente. Quando ela encerrou o mecenato em 1890, Tchaikovsky ficou devastado."", ""titulo"": ""Mecenas invisível"", ""categoria"": ""vida_pessoal""}, {""texto"": ""O Lago dos Cisnes estreou em 1877 com coreografia fraca e foi considerado fracasso. Só após sua morte, com nova coreografia de Marius Petipa (1895), tornou-se o balé mais famoso do mundo."", ""titulo"": ""Balés rejeitados no início"", ""categoria"": ""obras""}, {""texto"": ""Morreu 9 dias após estreia da Sinfonia nº 6 Pathétique. Causa oficial: cólera (água contaminada). Teorias modernas sugerem suicídio forçado por corte de honra devido a escândalo homossexual, mas evidências são inconclusivas."", ""titulo"": ""Morte misteriosa"", ""categoria"": ""morte""}]",https://upload.wikimedia.org/wikipedia/commons/thumb/2/28/Tchaikovsky_by_Reutlinger.jpg/800px-Tchaikovsky_by_Reutlinger.jpg,https://www.youtube.com/watch?v=_Qz1_jJF6zQ,5,"[""romantico"",""russo"",""bale"",""sinfonia"",""orquestracao""]",true,2025-10-09 02:15:02.70535+00
faa61f81-2bdb-4a04-96fb-2fbbb259babf,Wilhelm Richard Wagner,Wagner,1813-05-22,1883-02-13,Alemanha,Leipzig,e8ce8fcc-5d20-4557-be06-c908b975e141,Revolucionou a ópera com o drama musical total (Gesamtkunstwerk) e o cromatismo extremo que levou à dissolução da tonalidade,"Richard Wagner (1813-1883) é a figura mais revolucionária e controversa da ópera. Desenvolveu o conceito de Gesamtkunstwerk (obra de arte total): fusão de música, drama, poesia, cenografia, filosofia. Criou o leitmotiv: motivos musicais recorrentes associados a personagens, objetos, ideias. Sua harmonia cromática extrema (especialmente no Tristão e Isolda, 1865, com o famoso ""acorde de Tristão"") suspende a tonalidade e pavimenta caminho para atonalidade do século XX. Obras principais são óperas monumentais: Der Ring des Nibelungen (O Anel do Nibelungo, 1876: tetralogia de 4 óperas, 15 horas totais), Tristan und Isolde, Die Meistersinger von Nürnberg, Parsifal. Construiu Festspielhaus em Bayreuth (1876), teatro especialmente desenhado para suas óperas (orquestra invisível, acústica perfeita). Vida pessoal escandalosa: múltiplos casamentos/amantes, incluindo Cosima (filha de Liszt, casada com maestro Hans von Bülow), dívidas enormes, exílios políticos, mecenato do Rei Ludwig II da Baviera (louco por Wagner). Escreveu seus próprios libretos. Antissemitismo virulento em ensaios (Das Judentum in der Musik) manchou legado; nazistas apropriaram-se de sua música. Apesar de controvérsias, revolucionou ópera e influenciou profundamente música, filosofia (Nietzsche foi amigo depois inimigo), literatura, cinema (John Williams usa técnicas wagnerianas em Star Wars).","[""Der Ring des Nibelungen (O Anel do Nibelungo - tetralogia: Das Rheingold, Die Walküre, Siegfried, Götterdämmerung)"",""Tristan und Isolde (Tristão e Isolda)"",""Die Meistersinger von Nürnberg (Os Mestres Cantores de Nuremberg)"",""Tannhäuser"",""Lohengrin"",""Parsifal"",""Der fliegende Holländer (O Holandês Voador)"",""Siegfried Idyll"",""Cavalgada das Valquírias (de Die Walküre)""]",Drama musical alemão,[],"[{""texto"": ""Rei Ludwig II da Baviera, obcecado por Wagner, pagou todas suas dívidas, financiou óperas e construiu Festspielhaus em Bayreuth. Ludwig gastou fortuna com Wagner, quase falindo a Baviera, e construiu castelos de conto de fadas (Neuschwanstein)."", ""titulo"": ""Rei louco da Baviera"", ""categoria"": ""mecenato""}, {""texto"": ""O acorde de Tristão (abertura de Tristão e Isolda, 1859) é considerado o momento que rompe com a tonalidade tradicional. Sua resolução ambígua suspende a sensação tonal, abrindo caminho para Schoenberg e a atonalidade."", ""titulo"": ""Tristão: início da música moderna"", ""categoria"": ""revolucao""}, {""texto"": ""Escreveu Das Judentum in der Musik (O Judaísmo na Música, 1850), panfleto antissemita virulento. Nazistas apropriaram-se de sua música; Hitler adorava Wagner. Por isso, até hoje suas óperas são raramente apresentadas em Israel."", ""titulo"": ""Antissemitismo e nazismo"", ""categoria"": ""controversia""}]",https://upload.wikimedia.org/wikipedia/commons/thumb/9/9d/RichardWagner.jpg/800px-RichardWagner.jpg,https://www.youtube.com/watch?v=GGU1P6lBW6Q,5,"[""romantico"",""alemao"",""opera"",""leitmotiv"",""cromatismo""]",true,2025-10-09 02:15:02.70535+00